[
  {
    "id": "REQ-000001",
    "title": "Cannot access billing dashboard",
    "description": "When I click on the Billing tab in the navigation menu, I get a 403 Forbidden error. I'm logged in as an admin user and should have access to this section. This started happening this morning after the system upgrade.",
    "category": "billing",
    "priority": "P1",
    "status": "in_progress",
    "requester_type": "enterprise",
    "channel": "web_form",
    "created_at": "2026-02-04T08:15:00Z",
    "updated_at": "2026-02-04T09:30:00Z",
    "assigned_to": "agent-003",
    "resolution_code": null,
    "tags": ["billing", "dashboard", "permissions", "access-error"]
  },
  {
    "id": "REQ-000002",
    "title": "Unable to login to account",
    "description": "I've been trying to log in for the past hour but keep getting 'Invalid credentials' even though I'm certain my password is correct. I've tried resetting my password but didn't receive the reset email.",
    "category": "technical",
    "priority": "P1",
    "status": "resolved",
    "requester_type": "paid",
    "channel": "email",
    "created_at": "2026-02-03T14:22:00Z",
    "updated_at": "2026-02-03T16:45:00Z",
    "assigned_to": "agent-001",
    "resolution_code": "solved",
    "tags": ["login", "authentication", "password-reset"]
  },
  {
    "id": "REQ-000003",
    "title": "Request documentation for API v2 endpoints",
    "description": "I'm integrating with your API and noticed that the v2 documentation is incomplete. Specifically, I need information about the webhook event schemas and rate limiting policies.",
    "category": "general",
    "priority": "P3",
    "status": "triaged",
    "requester_type": "paid",
    "channel": "web_form",
    "created_at": "2026-02-03T10:05:00Z",
    "updated_at": "2026-02-03T11:20:00Z",
    "assigned_to": "agent-005",
    "resolution_code": null,
    "tags": ["documentation", "api", "webhooks"]
  },
  {
    "id": "REQ-000004",
    "title": "Payment failed - card declined",
    "description": "My monthly subscription payment failed this morning. The error message says 'Card declined' but I just used this card successfully elsewhere. Please help me update my payment method.",
    "category": "billing",
    "priority": "P1",
    "status": "closed",
    "requester_type": "paid",
    "channel": "chat",
    "created_at": "2026-02-02T09:30:00Z",
    "updated_at": "2026-02-02T10:15:00Z",
    "assigned_to": "agent-003",
    "resolution_code": "solved",
    "tags": ["payment", "billing", "card-declined"]
  },
  {
    "id": "REQ-000005",
    "title": "System completely down - production outage",
    "description": "Our entire production system has been offline for the past 15 minutes. All users are getting 500 errors. This is affecting our business operations significantly. URGENT!",
    "category": "technical",
    "priority": "P0",
    "status": "closed",
    "requester_type": "enterprise",
    "channel": "phone",
    "created_at": "2026-02-01T15:00:00Z",
    "updated_at": "2026-02-01T17:30:00Z",
    "assigned_to": "agent-001",
    "resolution_code": "solved",
    "tags": ["outage", "production", "critical", "downtime"]
  },
  {
    "id": "REQ-000006",
    "title": "Update email address on account",
    "description": "I need to change my email address from my old company email to my personal email. Current: old@company.com, New: personal@gmail.com",
    "category": "account",
    "priority": "P2",
    "status": "in_progress",
    "requester_type": "paid",
    "channel": "email",
    "created_at": "2026-02-04T07:45:00Z",
    "updated_at": "2026-02-04T08:10:00Z",
    "assigned_to": "agent-004",
    "resolution_code": null,
    "tags": ["account", "email-change"]
  },
  {
    "id": "REQ-000007",
    "title": "Slow performance when loading reports",
    "description": "The analytics dashboard is taking 30+ seconds to load. This only started yesterday. Other pages load fine. I'm using Chrome on macOS.",
    "category": "technical",
    "priority": "P2",
    "status": "waiting",
    "requester_type": "enterprise",
    "channel": "web_form",
    "created_at": "2026-02-03T16:00:00Z",
    "updated_at": "2026-02-04T09:00:00Z",
    "assigned_to": "agent-002",
    "resolution_code": null,
    "tags": ["performance", "slow-loading", "analytics", "dashboard"]
  },
  {
    "id": "REQ-000008",
    "title": "Invoice missing for last month",
    "description": "I haven't received my invoice for January 2026. Can you please resend it to my email? I need it for accounting purposes.",
    "category": "billing",
    "priority": "P3",
    "status": "triaged",
    "requester_type": "paid",
    "channel": "email",
    "created_at": "2026-02-04T06:30:00Z",
    "updated_at": "2026-02-04T07:00:00Z",
    "assigned_to": "agent-003",
    "resolution_code": null,
    "tags": ["invoice", "billing", "resend"]
  },
  {
    "id": "REQ-000009",
    "title": "How to export data to CSV",
    "description": "I'm trying to export my data to CSV format but can't find the export button. Can you provide step-by-step instructions?",
    "category": "general",
    "priority": "P3",
    "status": "resolved",
    "requester_type": "free",
    "channel": "chat",
    "created_at": "2026-02-03T13:15:00Z",
    "updated_at": "2026-02-03T13:45:00Z",
    "assigned_to": "agent-005",
    "resolution_code": "solved",
    "tags": ["how-to", "export", "csv"]
  },
  {
    "id": "REQ-000010",
    "title": "API rate limit errors",
    "description": "Getting 429 Too Many Requests errors when calling the /api/v1/data endpoint. We're well within our documented rate limits. Error started around 2pm UTC.",
    "category": "technical",
    "priority": "P1",
    "status": "in_progress",
    "requester_type": "enterprise",
    "channel": "api",
    "created_at": "2026-02-04T14:05:00Z",
    "updated_at": "2026-02-04T14:30:00Z",
    "assigned_to": "agent-002",
    "resolution_code": null,
    "tags": ["api", "rate-limit", "429-error"]
  },
  {
    "id": "REQ-000011",
    "title": "Feature request: Dark mode support",
    "description": "Would love to see a dark mode option in the UI. Working late nights and the bright interface is hard on the eyes.",
    "category": "general",
    "priority": "P3",
    "status": "new",
    "requester_type": "paid",
    "channel": "web_form",
    "created_at": "2026-02-04T22:00:00Z",
    "updated_at": "2026-02-04T22:00:00Z",
    "assigned_to": null,
    "resolution_code": null,
    "tags": ["feature-request", "dark-mode", "ui"]
  },
  {
    "id": "REQ-000012",
    "title": "Cannot add team members",
    "description": "When I try to invite new team members through the Team Settings page, I get an error 'Maximum team size reached'. We're only at 8/10 members according to our plan.",
    "category": "account",
    "priority": "P2",
    "status": "triaged",
    "requester_type": "enterprise",
    "channel": "email",
    "created_at": "2026-02-04T11:20:00Z",
    "updated_at": "2026-02-04T12:00:00Z",
    "assigned_to": "agent-004",
    "resolution_code": null,
    "tags": ["team-management", "invites", "error"]
  },
  {
    "id": "REQ-000013",
    "title": "Duplicate charge on credit card",
    "description": "I was charged twice for this month's subscription ($99 x 2). Please refund the duplicate charge immediately.",
    "category": "billing",
    "priority": "P1",
    "status": "resolved",
    "requester_type": "paid",
    "channel": "phone",
    "created_at": "2026-02-03T08:00:00Z",
    "updated_at": "2026-02-03T10:30:00Z",
    "assigned_to": "agent-003",
    "resolution_code": "solved",
    "tags": ["refund", "duplicate-charge", "billing"]
  },
  {
    "id": "REQ-000014",
    "title": "Two-factor authentication not working",
    "description": "I enabled 2FA yesterday but now I can't login. The authenticator app code is being rejected. I don't have backup codes.",
    "category": "technical",
    "priority": "P1",
    "status": "in_progress",
    "requester_type": "paid",
    "channel": "chat",
    "created_at": "2026-02-04T09:00:00Z",
    "updated_at": "2026-02-04T09:45:00Z",
    "assigned_to": "agent-001",
    "resolution_code": null,
    "tags": ["2fa", "authentication", "login"]
  },
  {
    "id": "REQ-000015",
    "title": "Question about enterprise pricing",
    "description": "We're a team of 50 looking to upgrade from Business to Enterprise. What are the pricing options and what additional features do we get?",
    "category": "general",
    "priority": "P2",
    "status": "new",
    "requester_type": "paid",
    "channel": "web_form",
    "created_at": "2026-02-04T21:30:00Z",
    "updated_at": "2026-02-04T21:30:00Z",
    "assigned_to": null,
    "resolution_code": null,
    "tags": ["sales", "pricing", "enterprise", "upgrade"]
  },
  {
    "id": "REQ-000016",
    "title": "Data export failed - timeout error",
    "description": "Trying to export 6 months of data but the export times out after 5 minutes. Can you help me get this data?",
    "category": "technical",
    "priority": "P2",
    "status": "triaged",
    "requester_type": "enterprise",
    "channel": "email",
    "created_at": "2026-02-04T10:00:00Z",
    "updated_at": "2026-02-04T11:00:00Z",
    "assigned_to": "agent-002",
    "resolution_code": null,
    "tags": ["export", "timeout", "data"]
  },
  {
    "id": "REQ-000017",
    "title": "Mobile app crashing on iOS",
    "description": "The mobile app crashes immediately on launch after the latest update (v3.2.1). iPhone 14 Pro, iOS 17.2.",
    "category": "technical",
    "priority": "P1",
    "status": "in_progress",
    "requester_type": "paid",
    "channel": "email",
    "created_at": "2026-02-04T07:00:00Z",
    "updated_at": "2026-02-04T08:00:00Z",
    "assigned_to": "agent-006",
    "resolution_code": null,
    "tags": ["mobile", "ios", "crash", "bug"]
  },
  {
    "id": "REQ-000018",
    "title": "Need to downgrade subscription",